{
  "version": 2,
  "units": "cm",
  "title": "Производственный цех (CAD-light)",
  "style": {
    "render_profile": "technical_bw",
    "show_grid": true,
    "grid_step": 100,
    "show_coord_grid": true,
    "technical": {
      "wall_stroke": 2.5,
      "equipment_stroke": 0.9,
      "hatch_storage": true,
      "room_fill_technical": "#f4f4f4"
    }
  },
  "rooms": [
    {
      "id": "hall",
      "name": "Производственный цех 20×20 м",
      "zone_type": "production",
      "polygon": [[0, 0], [2000, 0], [2000, 2000], [0, 2000]]
    }
  ],
  "equipment": [
    {
      "id": "eq_pack",
      "label": "Блок фасовки 380×350 см",
      "z_index": 1,
      "bbox": {"x": 80, "y": 800, "width": 380, "height": 350, "rotation": 0},
      "representation": {"library_key": "packing_block"}
    },
    {
      "id": "eq_conv",
      "label": "Транспортёр мешков",
      "z_index": 2,
      "bbox": {"x": 500, "y": 900, "width": 770, "height": 190, "rotation": 0},
      "representation": {"library_key": "conveyor_linear"}
    },
    {
      "id": "eq_robot",
      "label": "Робот-манипулятор 500×500 см",
      "z_index": 3,
      "bbox": {"x": 1350, "y": 700, "width": 500, "height": 500, "rotation": 0},
      "representation": {"library_key": "robot_cell"}
    }
  ],
  "annotations": {
    "callouts": [
      {"id": "1", "text": "Блок фасовки", "target_id": "eq_pack", "offset": {"dx": -120, "dy": 60}},
      {"id": "2", "text": "Конвейер", "target_id": "eq_conv", "offset": {"dx": 0, "dy": -80}},
      {"id": "3", "text": "Робот", "target_id": "eq_robot", "offset": {"dx": 100, "dy": -40}}
    ]
  }
}
